<?xml version="1.0" encoding="UTF-8"?>
<xs:schema xmlns:xs="http://www.w3.org/2001/XMLSchema">

<xs:simpleType name="dniType">
	<xs:restriction base="xs:string">
		<xs:pattern value="[0-9]{8}[A-Z]"/>
	</xs:restriction>
</xs:simpleType>

<xs:simpleType name="numTelType">
	<xs:restriction base="xs:string">
		<xs:pattern value="[0-9]{9}"/>
	</xs:restriction>
</xs:simpleType>

<xs:simpleType name="correoType">
	<xs:restriction base="xs:string">
		<xs:pattern value="[a-zA-Z0-9._%+-]+@[a-zA-Z0-9.-]+\.[a-zA-Z]{2,}"/>
	</xs:restriction>
</xs:simpleType>

<xs:simpleType name="codPostType">
	<xs:restriction base="xs:string">
		<xs:pattern value="[0-9]{5}"/>
	</xs:restriction>
</xs:simpleType>


	<xs:element name="profesores">
		<xs:complexType>
			<xs:sequence>
				<xs:element name="profesor" maxOccurs="unbounded">
					<xs:complexType>
						<xs:sequence>
							<xs:element name="nombre" type="xs:string"/>
							<xs:element name="apellidos" type="xs:string"/>
							<xs:element name="numTel" type="numTelType"/>
							<xs:element name="correoElec" type="correoType"/>
							<xs:element name="fecNacimiento" type="xs:date"/>
							<xs:element name="domicilio" type="xs:string"/>
							<xs:element name="codPost" type="codPostType"/>
						</xs:sequence>
						<xs:attribute name="dni" type="dniType" use="required"/>
						<xs:attribute name="fechContratacion" type="xs:date" use="required"/>
					</xs:complexType>
				</xs:element>
			</xs:sequence>
		</xs:complexType>
	</xs:element>
</xs:schema>
